{
  "name": "my block",
  "blocks": [{ "type": "@app" }, { "type": "@theme" }],
  "class": "my-class",
  "tag": "custom-element",
  "settings": [
    {
      "type": "header",
      "content": "header name",
      "info": "header info"
    },
    {
      "type": "number",
      "id": "number",
      "label": "my number"
    }
  ],
  "presets": [
    {
      "name": "preset name",
      "settings": {
        "number": 1
      },
      "blocks": [
        {
          "type": "thing",
          "settings": {
            "some-setting": "some-value"
          }
        }
      ]
    }
  ]
}
