{
  "name": "Collapsible row",
  "tag": "details",
  "blocks": [{ "type": "@theme" }, { "type": "@app" }],
  "settings": [
    {
      "type": "text",
      "id": "summary",
      "label": "Heading",
      "default": "Collapsible row"
    },
    {
      "type": "select",
      "id": "icon",
      "label": "Icon",
      "options": [
        {
          "value": "none",
          "label": "None"
        },
        {
          "value": "apple",
          "label": "Apple"
        },
        {
          "value": "arrow",
          "label": "Arrow"
        },
        {
          "value": "banana",
          "label": "Banana"
        },
        {
          "value": "bottle",
          "label": "Bottle"
        },
        {
          "value": "box",
          "label": "Box"
        },
        {
          "value": "carrot",
          "label": "Carrot"
        },
        {
          "value": "chat_bubble",
          "label": "Chat bubble"
        },
        {
          "value": "check_mark",
          "label": "Check mark"
        },
        {
          "value": "clipboard",
          "label": "Clipboard"
        },
        {
          "value": "dairy",
          "label": "Dairy"
        },
        {
          "value": "dairy_free",
          "label": "Dairy free"
        },
        {
          "value": "dryer",
          "label": "Dryer"
        },
        {
          "value": "eye",
          "label": "Eye"
        },
        {
          "value": "facebook",
          "label": "Facebook"
        },
        {
          "value": "fire",
          "label": "Fire"
        },
        {
          "value": "gluten_free",
          "label": "Gluten free"
        },
        {
          "value": "heart",
          "label": "Heart"
        },
        {
          "value": "instagram",
          "label": "Instagram"
        },
        {
          "value": "iron",
          "label": "Iron"
        },
        {
          "value": "leaf",
          "label": "Leaf"
        },
        {
          "value": "leather",
          "label": "Leather"
        },
        {
          "value": "lightning_bolt",
          "label": "Lightning bolt"
        },
        {
          "value": "lipstick",
          "label": "Lipstick"
        },
        {
          "value": "lock",
          "label": "Lock"
        },
        {
          "value": "map_pin",
          "label": "Map pin"
        },
        {
          "value": "nut_free",
          "label": "Nut free"
        },
        {
          "value": "pants",
          "label": "Pants"
        },
        {
          "value": "paw_print",
          "label": "Paw print"
        },
        {
          "value": "pepper",
          "label": "Pepper"
        },
        {
          "value": "perfume",
          "label": "Perfume"
        },
        {
          "value": "pinterest",
          "label": "Pinterest"
        },
        {
          "value": "plane",
          "label": "Plane"
        },
        {
          "value": "plant",
          "label": "Plant"
        },
        {
          "value": "price_tag",
          "label": "Price tag"
        },
        {
          "value": "question_mark",
          "label": "Question mark"
        },
        {
          "value": "recycle",
          "label": "Recylce"
        },
        {
          "value": "return",
          "label": "Return"
        },
        {
          "value": "ruler",
          "label": "Ruler"
        },
        {
          "value": "serving_dish",
          "label": "Serving dish"
        },
        {
          "value": "shirt",
          "label": "Shirt"
        },
        {
          "value": "shoe",
          "label": "Shoe"
        },
        {
          "value": "silhouette",
          "label": "Silhouette"
        },
        {
          "value": "snapchat",
          "label": "Snapchat"
        },
        {
          "value": "snowflake",
          "label": "Snowflake"
        },
        {
          "value": "star",
          "label": "Star"
        },
        {
          "value": "stopwatch",
          "label": "Stopwatch"
        },
        {
          "value": "tiktok",
          "label": "Tiktok"
        },
        {
          "value": "truck",
          "label": "Truck"
        },
        {
          "value": "tumblr",
          "label": "Tumblr"
        },
        {
          "value": "twitter",
          "label": "X (Twitter)"
        },
        {
          "value": "vimeo",
          "label": "Vimeo"
        },
        {
          "value": "washing",
          "label": "Washing"
        }
      ],
      "default": "check_mark"
    }
  ],
  "presets": [{ "name": "Collapsible row" }]
}
